{
  "scenario_id": "second_incident",
  "description": "Bay 7 repeat of the hero pattern with denser event spacing (5s gaps). Demonstrates faster detection time when lessons_learned collection is populated — proving 'half the detection time' claim. Same risk signature, different bay and equipment.",
  "speed_multiplier_default": 2.0,
  "events": [
    {
      "offset_seconds": 0,
      "source": "shift",
      "zone_id": "Bay7",
      "equipment_id": null,
      "value": null,
      "unit": null,
      "severity_hint": "elevated",
      "metadata": {
        "shift_id": "SHF-2026-0809-B7-PM",
        "zone_id": "Bay7",
        "event": "changeover_warning",
        "changeover_in_minutes": 20,
        "supervisor": "Lt-Vasquez",
        "headcount": 11
      }
    },
    {
      "offset_seconds": 5,
      "source": "gas_sensor",
      "zone_id": "Bay7",
      "equipment_id": "gas-detector-B7-01",
      "value": 200,
      "unit": "ppm",
      "severity_hint": "normal",
      "metadata": {
        "baseline_ppm": 200,
        "note": "Baseline established"
      }
    },
    {
      "offset_seconds": 10,
      "source": "maintenance",
      "zone_id": "Bay7",
      "equipment_id": "compressor-C22",
      "value": null,
      "unit": null,
      "severity_hint": "elevated",
      "metadata": {
        "record_id": "MNT-C22-0809-001",
        "equipment_id": "compressor-C22",
        "fault_code": "DRIFT-001",
        "summary": "Compressor C-22 flagged for pressure drift — same fault code as Bay 3 incident"
      }
    },
    {
      "offset_seconds": 15,
      "source": "permit",
      "zone_id": "Bay7",
      "equipment_id": null,
      "value": null,
      "unit": null,
      "severity_hint": "elevated",
      "metadata": {
        "permit_id": "P-3104",
        "permit_type": "hot_work",
        "holder": "Officer-Chen",
        "action": "activated"
      }
    },
    {
      "offset_seconds": 20,
      "source": "gas_sensor",
      "zone_id": "Bay7",
      "equipment_id": "gas-detector-B7-01",
      "value": 211,
      "unit": "ppm",
      "severity_hint": "elevated",
      "metadata": {
        "baseline_ppm": 200,
        "note": "5.5% above baseline"
      }
    },
    {
      "offset_seconds": 25,
      "source": "scada",
      "zone_id": "Bay7",
      "equipment_id": "compressor-C22",
      "value": 8.3,
      "unit": "bar",
      "severity_hint": "normal",
      "metadata": {
        "tag": "PRESS-C22",
        "alarm_state": false
      }
    },
    {
      "offset_seconds": 30,
      "source": "gas_sensor",
      "zone_id": "Bay7",
      "equipment_id": "gas-detector-B7-01",
      "value": 216,
      "unit": "ppm",
      "severity_hint": "elevated",
      "metadata": {
        "baseline_ppm": 200,
        "note": "8% above — risk engine should detect faster due to Bay 3 lesson in memory"
      }
    },
    {
      "offset_seconds": 35,
      "source": "cctv",
      "zone_id": "Bay7",
      "equipment_id": null,
      "value": null,
      "unit": null,
      "severity_hint": "elevated",
      "metadata": {
        "event_type": "zone_entry",
        "confidence": 0.88,
        "zone_id": "Bay7"
      }
    },
    {
      "offset_seconds": 40,
      "source": "gas_sensor",
      "zone_id": "Bay7",
      "equipment_id": "gas-detector-B7-01",
      "value": 218,
      "unit": "ppm",
      "severity_hint": "elevated",
      "metadata": {
        "baseline_ppm": 200
      }
    },
    {
      "offset_seconds": 80,
      "source": "permit",
      "zone_id": "Bay7",
      "equipment_id": null,
      "value": null,
      "unit": null,
      "severity_hint": "normal",
      "metadata": {
        "permit_id": "P-3104",
        "permit_type": "hot_work",
        "holder": "Officer-Chen",
        "action": "suspended"
      }
    },
    {
      "offset_seconds": 85,
      "source": "gas_sensor",
      "zone_id": "Bay7",
      "equipment_id": "gas-detector-B7-01",
      "value": 203,
      "unit": "ppm",
      "severity_hint": "normal",
      "metadata": {
        "baseline_ppm": 200,
        "note": "Normalizing"
      }
    }
  ]
}
